{
  "id": "orphan-consumer",
  "name": "Orphan Consumer",
  "version": "1.0.0",
  "hooks": [
    {
      "id": "use-widgets",
      "hook_point": "review-post-score",
      "entry_point": "./use.js",
      "priority": 10,
      "failure_mode": "warn"
    }
  ],
  "consumes": [
    {
      "artifact_type": "widgets",
      "schema_version": "^1.0"
    }
  ]
}
